id,word,pos,part,section,japanese,sentence,sentence_ja
1,create,verb,1,1,を創り出す；を引き起こす,The company plans to create new job opportunities in the coming year.,その会社は来年、新たな雇用機会を創出する計画です。
2,increase,verb,1,1,増加する（⇔ decrease ⇒ 223）；を増やす,The company decided to increase its investment in renewable energy.,その会社は再生可能エネルギーへの投資を増やすことを決定した。
3,improve,verb,1,1,を向上させる；よくなる,"To improve one's academic performance, consistent effort and effective study habits are essential.",学業成績を向上させるためには、一貫した努力と効果的な学習習慣が不可欠です。
4,mean,verb,1,1,を意味する；（...する）つもりである（to do）,Success doesn't always mean happiness.,成功が必ずしも幸福を意味するわけではない。
5,own,verb,1,1,を所有している；（事実・罪など）を認める,He plans to own a small business after graduating from university.,彼は大学を卒業後、小さな会社を所有する計画だ。
6,include,verb,1,1,を含む（⇔ exclude ⇒ 1009）,Our tour package includes accommodation and breakfast.,私たちのツアーパッケージには宿泊と朝食が含まれています。
7,consider,verb,1,1,を見なす；について考える,We should consider all options before making a final decision.,最終決定をする前に、すべての選択肢を検討すべきだ。
8,allow,verb,1,1,を許す；を与える；（～を）考慮に入れる（for）,The new policy will allow more students to participate in extracurricular activities.,新しい方針により、より多くの学生が課外活動に参加できるようになります。
9,suggest,verb,1,1,を提案する；を暗示する,The professor suggested that students read the supplementary materials to deepen their understanding of the complex theory.,教授は、学生たちがその複雑な理論の理解を深めるために、補足資料を読むことを提案した。
10,produce,verb,1,1,を生産する；を取り出す,"Deforestation can reduce the ability of forests to produce oxygen, a vital component for life on Earth.",森林破壊は、地球上の生命にとって不可欠な要素である酸素を生産する森林の能力を低下させる可能性があります。
11,decide,verb,1,1,を決める；に決着をつける,"After much deliberation, the committee decided to approve the new proposal.",熟慮の結果、委員会は新しい提案を承認することを決定した。
12,offer,verb,1,1,を提供する，申し出る,The university decided to offer a new scholarship to encourage international students.,大学は、留学生を奨励するために、新しい奨学金を提供することにしました。
13,require,verb,1,1,を要求する；を必要とする,"To enter the advanced course, students are required to have a strong foundation in mathematics.",上級コースを受講するには、学生は数学のしっかりとした基礎を持っていることが求められます。
14,share,verb,1,1,を共有する；を分担する,Students are encouraged to share their ideas during group discussions.,学生たちはグループ討論中に自分の意見を共有するよう勧められています。
15,store,verb,1,1,を保存する；を蓄える,"This warehouse is designed to store perishable goods at low temperatures, ensuring their freshness over extended periods.",この倉庫は、生鮮品を低温で保存するように設計されており、長期間にわたってその鮮度を保ちます。
16,tend,verb,1,1,傾向がある；を世話する,Many people tend to choose convenience over quality in their daily lives.,多くの人々は日常生活において、品質よりも利便性を選ぶ傾向があります。
17,concern,verb,1,1,〔受身形で〕心配している；〔受身形で〕（～に）関係する（with）；に関連する,Many people are concerned about the impact of climate change on future generations.,多くの人々は、気候変動が将来の世代に与える影響について懸念している。
18,describe,verb,1,1,について述べる，を説明する,It is often difficult to accurately describe complex emotions in simple terms.,複雑な感情を簡単な言葉で正確に説明することは、しばしば困難です。
19,involve,verb,1,1,を関与させる；を伴う,Being a doctor involves a great deal of responsibility.,医者であることは、多大な責任を伴う。
20,reduce,verb,1,1,を減らす；を（～に）変える（to）,The government launched a new initiative to reduce the nation's reliance on fossil fuels over the next decade.,政府は今後10年間で、国の化石燃料への依存度を減らすための新たな取り組みを開始しました。
21,design,verb,1,1,を設計する；を計画する,It takes years of practice for an architect to design a building that is both functional and aesthetically pleasing.,建築家が機能的かつ見た目にも美しい建物を設計するには、長年の練習が必要です。
22,force,verb,1,1,に強いる；を強要する,He was forced to admit his mistake.,彼は自分の間違いを認めざるを得なかった。
23,limit,verb,1,1,を制限［規制］する,Governments often implement policies to limit the emission of greenhouse gases.,政府はしばしば、温室効果ガスの排出を制限するための政策を実施します。
24,bear,verb,1,1,に耐える（≒ endure ⇒ 824）；を負う；を産む；を（心に）抱く,It was difficult to bear the intense heat during the summer.,夏の間の猛烈な暑さに耐えるのは困難でした。
25,affect,verb,1,1,に影響を及ぼす（≒ influence ⇒ 49）；を感動させる,The new policy will significantly affect the local economy.,新しい政策は地域経済に大きな影響を与えるでしょう。
26,deal,verb,1,1,〔deal withで〕を処理する；〔deal inで〕を商う；を分配する,The government is expected to deal with the economic crisis promptly.,政府は経済危機に迅速に対処することが期待されている。
27,avoid,verb,1,1,を避ける,"To avoid making common mistakes, it's important to carefully review your work.",よくある間違いをしないように、自分の仕事を慎重に見直すことが大切です。
28,relate,verb,1,1,を関連づける；（～に）関連する（to）,It is important for scientists to be able to clearly relate their research findings to practical applications.,科学者は、自らの研究結果を実用的な応用と明確に関連付けることが重要である。
29,realize,verb,1,1,に気づく；を実現する,She didn't realize the importance of studying abroad until she actually experienced it.,彼女は実際に留学を経験するまで、その重要性に気づきませんでした。
30,encourage,verb,1,1,を奨励する；を励ます（⇔ discourage ⇒ 706）,The university encourages its students to participate in international exchange programs to broaden their horizons.,大学は、学生が視野を広げるために国際交流プログラムに参加することを奨励しています。
31,compare,verb,1,1,を比較する；を（～に）たとえる（to）,"When evaluating the effectiveness of the new policy, it's essential to compare its results with those of the previous one.",新しい政策の有効性を評価する際、その結果を以前のものと比較することが不可欠です。
32,measure,verb,1,1,を測る；を（比較して）評価する,The success of a new policy is often difficult to measure accurately without long-term data.,長期的なデータがなければ、新しい政策の成功を正確に評価することはしばしば困難である。
33,exist,verb,1,1,存在する；生存する,"For true happiness to exist, one must find a balance between personal desires and external responsibilities.",真の幸福が存在するためには、個人の願望と外部の責任との間でバランスを見つける必要がある。
34,mark,verb,1,1,に印をつける；を（記号で）示す；に汚れをつける,The teacher will mark the exams tomorrow.,先生は明日、試験を採点します。
35,challenge,noun,1,1,に異議を唱える；（人）に挑む,Studying for the university entrance exam was a significant challenge for me.,私にとって、大学の入学試験の勉強は大きな挑戦でした。
36,depend,verb,1,1,頼る；～次第である,The success of the project will largely depend on the cooperation of all team members.,プロジェクトの成功は、チームメンバー全員の協力に大きく左右されるだろう。
37,object,verb,1,1,反対する；（...）と言って反対する（that節）,The residents strongly objected that the proposed construction project would destroy the natural habitat.,住民たちは、提案された建設プロジェクトが自然生息地を破壊するだろうと強く反対した。
38,demand,verb,1,1,を要求する,The new policy demands a thorough understanding of its implications before implementation.,その新しい政策は、実施前にその影響について徹底的な理解を要求する。
39,found,verb,1,1,を設立する；（理論など）を（～に基づいて）築く（on）,Harvard University was founded in 1636.,ハーバード大学は1636年に設立されました。
40,complete,verb,1,1,を完成させる，仕上げる,Please complete the assignment before the deadline.,締め切りまでに課題を完成させてください。
41,idea,noun,1,1,考え，思いつき；理解；見解；概念,Developing a sustainable energy source is an ambitious idea that requires global cooperation.,持続可能なエネルギー源の開発は、国際的な協力が求められる野心的なアイデアである。
42,accord,noun,1,1,一致；合意，協定,It is important that our environmental policies are in accord with international standards.,私たちの環境政策が国際基準と一致していることが重要です。
43,company,noun,1,1,会社；〔集合的に〕仲間；（仲間と）一緒にいること；一座,He found great comfort in the company of his family during difficult times.,彼は困難な時期に、家族と一緒にいることに大きな慰めを感じた。
44,interest,noun,1,1,興味；利子；利害,"Many young people are beginning to take an interest in environmental issues, advocating for sustainable practices.",多くの若者が環境問題に興味を持ち始め、持続可能な実践を提唱しています。
45,research,noun,1,1,（～についての）研究，調査（into / on / in）,Extensive research is needed to understand the long-term effects of climate change.,気候変動の長期的な影響を理解するためには、広範な研究が必要です。
46,cause,noun,1,1,原因（⇔ effect ⇒ 48）；理由；大義,The primary cause of global warming is the emission of greenhouse gases from human activities.,地球温暖化の主な原因は、人間の活動による温室効果ガスの排出です。
47,reason,noun,1,1,理由；（...する）根拠（to do）；理性；分別,The main reason for his success was his dedication to hard work.,彼の成功の主な理由は、彼の勤勉な努力でした。
48,effect,noun,1,1,影響，効果；結果,The new regulations are expected to have a significant effect on air quality in the city.,新しい規制は、市内の大気質に大きな影響を与えることが予想されています。
49,influence,noun,1,1,影響（力）,The internet has had a profound influence on how people interact with each other.,インターネットは、人々が互いに交流し合う方法に大きな影響を与えてきた。
50,situation,noun,1,1,状況；（人の置かれた）立場,We need to assess the situation carefully before making any rash decisions.,軽率な判断をする前に、私たちは状況を慎重に見極める必要があります。
51,environment,noun,1,1,環境（≒ surroundings）,Protecting the natural environment is crucial for the survival of future generations.,自然環境を保護することは、将来の世代の生存のために極めて重要である。
52,skill,noun,1,1,技能；熟練,Effective communication is a crucial skill in any profession.,効果的なコミュニケーションは、どのような職業においても不可欠なスキルです。
53,matter,noun,1,1,事柄；問題；〔～s〕事態；〔the ～〕困難；物質,We need to discuss this important matter at our next meeting.,次の会議で、この重要な事柄について話し合う必要があります。
54,view,noun,1,1,（～についての）見解（on / about）；（～に対する）（特定の）見方（of）；眺め,Many people hold different views on the environmental issue.,多くの人々がその環境問題について異なる見解を持っています。
55,value,noun,1,1,価値；価格；評価；〔～s〕価値観,"The true value of a gift lies not in its price, but in the thought behind it.",贈り物の本当の価値は、その値段ではなく、その裏にある気持ちにあります。
56,species,noun,1,1,（生物の）種；種類,Protecting endangered species is vital for maintaining the balance of ecosystems worldwide.,絶滅危惧種の保護は、世界中の生態系のバランスを維持するために不可欠である。
57,thought,noun,1,1,考え；思考,Deep thought is often required to solve complex problems.,複雑な問題を解決するためには、深い思考がしばしば必要とされる。
58,knowledge,noun,1,1,知識；知っていること；認識,Acquiring new knowledge is essential for personal growth and career development.,新しい知識を習得することは、個人の成長とキャリアの発展にとって不可欠です。
59,memory,noun,1,1,記憶（力）；（～の）思い出（of）,"Humans possess an incredible capacity for memory, allowing them to recall complex experiences and acquire new knowledge throughout their lives.",人間は驚くべき記憶力を持っており、それによって複雑な経験を思い出し、生涯にわたって新しい知識を習得することができる。
60,practice,noun,1,1,実践，実行；（社会の）慣習；練習,Consistent practice is essential for mastering any new skill.,どんな新しいスキルを習得する上でも、継続的な練習は不可欠です。
61,benefit,noun,1,1,利益，恩恵；給付金,Studying abroad offers many cultural and educational benefits.,留学は多くの文化的、教育的な恩恵をもたらします。
62,theory,noun,1,1,学説；理論；原理；推測,"While the new theory offers a compelling explanation for the phenomenon, further empirical evidence is crucial to conclusively validate its claims.",その新しい学説はその現象に対して説得力のある説明を提供しているが、その主張を決定的に裏付けるためにはさらなる経験的証拠が不可欠である。
63,issue,noun,1,1,問題（点）；発行（物）；発表,One of the main issues discussed at the conference was how to achieve sustainable development.,会議で議論された主要な問題の一つは、持続可能な開発をいかに達成するかだった。
64,experiment,noun,1,1,（～を対象とする）実験（on）,Researchers must meticulously plan each experiment to ensure the reliability and validity of their findings.,研究者たちは、自分たちの発見の信頼性と妥当性を確保するために、各実験を入念に計画する必要があります。
65,article,noun,1,1,記事；条項；品物,The journalist published an insightful article discussing the long-term impact of artificial intelligence on society.,そのジャーナリストは、人工知能が社会に与える長期的な影響について洞察力に富んだ記事を発表した。
66,focus,noun,1,1,焦点；関心の的,The primary focus of this research project is to investigate the long-term effects of climate change on biodiversity.,この研究プロジェクトの主な焦点は、気候変動が生物多様性に与える長期的な影響を調査することである。
67,subject,noun,1,1,話題；科目；主題；被験者,The primary subject of the debate was the economic impact of technological advancements.,その討論の主要な主題は、技術的進歩が経済に与える影響でした。
68,project,noun,1,1,計画；事業；研究計画,The students successfully completed their group project on renewable energy.,学生たちは再生可能エネルギーに関するグループプロジェクトを無事完了しました。
69,quality,noun,1,1,質（⇔ quantity ⇒ 471）；特質,Many leading companies prioritize the quality of their products and services over simply maximizing sales volume.,多くの主要企業は、単に販売量を最大化するよりも、製品やサービスの質を優先している。
70,role,noun,1,1,役割；（俳優などの）役,The role of technology in modern education is constantly evolving.,現代教育におけるテクノロジーの役割は、絶えず進化している。
71,term,noun,1,1,（専門）用語；〔～s〕条件；〔～s〕間柄；学期,The first academic term usually runs from September to December.,最初の学期は通常、9月から12月までです。
72,statement,noun,1,1,声明；主張；明細書,The government issued a statement clarifying its position on the international treaty.,政府は国際条約に関する自国の立場を明確にする声明を発表しました。
73,material,noun,1,1,材料，素材；資料；生地,The architect carefully selected the building materials for their durability and aesthetic appeal.,建築家は、耐久性と美的魅力を考慮し、建築材料を慎重に選びました。
74,evidence,noun,1,1,証拠,The detective carefully examined all the available evidence.,刑事は、利用できるすべての証拠を慎重に調べた。
75,source,noun,1,1,（～の）源，根源（of）；出所，情報源,It's important to always check the source of information before believing it.,情報を鵜呑みにする前に、常にその情報源を確認することが大切です。
76,community,noun,1,1,（共同）社会，～界；地域社会；地域住民,Building a strong sense of community is essential for overcoming challenges and fostering mutual support among its members.,強い共同体意識を築くことは、課題を克服し、構成員間の相互支援を育む上で不可欠である。
77,technology,noun,1,1,科学技術；応用技術,The rapid development of new technology has profound implications for society and the economy.,新しい技術の急速な発展は、社会と経済に深い影響を与えている。
78,culture,noun,1,1,文化；教養；耕作；養殖；培養,Understanding the nuances of a foreign culture is crucial for effective international communication.,異文化の微妙な違いを理解することは、効果的な国際コミュニケーションのために不可欠です。
79,appropriate,adjective,1,1,（～に）適切な（for / to）,Students should choose an appropriate topic for their research paper.,学生は研究論文に適切なテーマを選ぶべきだ。
80,likely,adjective,1,1,ありそうな（⇔ unlikely ありそうもない）,"It is highly likely that the new policy will be implemented next year, despite some initial opposition.",当初いくつかの反対があったにもかかわらず、新しい政策は来年には実施される可能性が非常に高い。
81,possible,adjective,1,1,可能な；可能性のある,Modern technology has made it possible to communicate instantly with people anywhere in the world.,現代の技術は、世界中のどこにいても人々と瞬時にコミュニケーションをとることを可能にした。
82,individual,noun,1,1,個々の；個人の,Every individual plays a vital role in the success of the community.,一人ひとりが、地域の成功において重要な役割を担っています。
83,public,adjective,1,1,公の（⇔ private 私的な）；公衆の；公開の,It is essential for public figures to maintain a high level of integrity and accountability.,公人は高い水準の誠実さと説明責任を維持することが不可欠である。
84,common,adjective,1,1,共通の；普通の；一般の,It is a common misconception that all snakes are venomous.,すべてのヘビが有毒であるというのは、よくある誤解です。
85,certain,adjective,1,1,確信して；確かな；ある；一定の,I am certain that regular exercise contributes significantly to overall well-being.,定期的な運動が全体的な健康に大きく貢献すると、私は確信しています。
86,similar,adjective,1,1,似ている，類似した；同様の,"The two species have similar physical characteristics, but their habitats are vastly different.",その2つの種は似たような身体的特徴を持つが、生息地は大きく異なる。
87,recent,adjective,1,1,最近の,A recent study suggests that climate change is progressing faster than previously estimated.,最近の研究では、気候変動が以前の推定よりも速く進行していることが示唆されています。
88,major,adjective,1,1,主要な；大きい（ほうの）；長調の,The government announced a major reform in the education system.,政府は教育制度における主要な改革を発表した。
89,patient,adjective,1,1,忍耐強い；勤勉な,"Being patient is crucial when learning a new language, as mastery often takes a considerable amount of time and effort.",新しい言語を習得する際には、習得にはかなりの時間と労力がかかるため、忍耐強くあることが極めて重要です。
90,particular,adjective,1,1,特定の；特別の；（～について）やかましい（about）,She pays particular attention to details in her artwork.,彼女は自分の作品の細部に特別な注意を払う。
91,physical,adjective,1,1,身体の（⇔ mental ⇒ 183）；物質的な；物理学の,Regular exercise is essential for good physical health.,定期的な運動は良好な身体の健康に不可欠です。
92,various,adjective,1,1,さまざまな；いくつかの,The university offers various scholarships to students with different academic backgrounds.,その大学は、多様な学術的背景を持つ学生向けに、さまざまな奨学金を提供している。
93,available,adjective,1,1,手に入る；利用できる；手が空いている,Information regarding scholarship opportunities is readily available on the university website for prospective students.,奨学金制度に関する情報は、入学希望者向けに大学のウェブサイトで簡単に入手できます。
94,native,adjective,1,1,出生地の；原産の；生得の,Achieving a truly native accent in a foreign language often requires extensive immersion and practice from an early age.,外国語で真にネイティブなアクセントを習得するには、幼い頃からの徹底的な没入と練習がしばしば必要となる。
95,political,adjective,1,1,政治（上）の,"Climate change is not merely an environmental issue, but also a significant political challenge.",気候変動は単なる環境問題であるだけでなく、重要な政治的課題でもあります。
96,due,adjective,1,1,予定された；（支払）期日で；しかるべき,Your research paper is due at the end of the semester.,あなたの研究論文は学期末が提出期限です。
97,blank,adjective,1,1,空白の；無表情な；がらんとした,"My mind went completely blank during the exam, and I couldn't recall even the simplest facts.",試験中に頭が真っ白になり、最も簡単な事実さえ思い出せなかった。
98,ancient,adjective,1,1,古代の；昔からの,Many ancient civilizations had advanced knowledge of astronomy.,多くの古代文明は、高度な天文学の知識を持っていました。
99,correct,adjective,1,1,正しい；適切な,"To ensure fairness, all test candidates must provide correct and complete answers.",公平を期すために、すべての試験受験者は正しく完全な回答を提出しなければなりません。
100,despite,preposition,1,1,～にもかかわらず（≒ in spite of）,"Despite the heavy traffic, we arrived at the airport on time.",激しい交通渋滞にもかかわらず、私たちは時間通りに空港に到着した。
101,notice,verb,1,2,に気づく,He was so engrossed in his book that he didn't notice the time passing.,彼は本に夢中だったので、時間が過ぎるのに気づかなかった。
102,refer,verb,1,2,言及する，関連する；参照する,"When you write an essay, it's important to refer to credible sources to support your arguments.",エッセイを書く際には、自分の主張を裏付けるために信頼できる情報源を参照することが重要です。
103,approach,verb,1,2,に近づく；に取り組む,"As the deadline approached, the team worked harder to finish the project.",締め切りが近づくにつれて、チームはプロジェクトを終えるためにより懸命に働いた。
