id,word,pos,part,section,japanese,sentence,sentence_ja
408,explore,verb,1,5,（を）調査［探究］する；（を）探検［探査］する,Students should explore various career options before making a final decision about their future.,学生は将来に関する最終決定を下す前に、様々な進路を模索すべきです。
409,amaze,verb,1,5,をびっくりさせる,Her ability to solve complex problems in minutes never ceases to amaze me.,彼女が複雑な問題を数分で解決する能力には、いつも驚かされます。
410,tear,verb,1,5,を引き裂く；裂ける,The strong wind could tear the tent if we don't secure it properly.,適切に固定しなければ、強風がそのテントを引き裂いてしまうかもしれません。
411,settle,verb,1,5,を解決する；（に）移り住む；を落ち着かせる,It took her a few weeks to settle into her new job and feel comfortable.,彼女が新しい仕事に慣れて、心地よく感じるまで数週間かかった。
412,afford,verb,1,5,を持つ［する］余裕がある；を与える,"In today's competitive job market, individuals cannot afford to be complacent about developing new skills.",今日の競争の激しい雇用市場では、個人は新しいスキルを身につけることに関して、自己満足に陥る余裕はない。
413,conclude,verb,1,5,と結論づける；を締めくくる；を締結する,"Based on the available data, researchers concluded that the new treatment significantly improved patients' conditions.",利用可能なデータに基づき、研究者たちは新しい治療法が患者の状態を著しく改善させたと結論づけた。
414,advertise,verb,1,5,を宣伝する；（～を求める）広告を出す（for）,Many businesses choose to advertise their services online to reach a wider audience.,多くの企業は、より幅広い層に届けるために、オンラインでサービスを宣伝することを選びます。
415,encounter,verb,1,5,に遭遇する；に（思いがけず）出会う,"During their expedition, the explorers expected to encounter various challenges in the uncharted jungle.",探検中、探検家たちは未開のジャングルで様々な困難に遭遇することを予想していた。
416,remind,verb,1,5,に思い出させる,The old photograph reminded him of his childhood.,その古い写真は彼に彼の子供時代を思い出させた。
417,locate,verb,1,5,〔受身形で〕位置する；の位置を探し当てる,The company decided to locate its new factory in the suburbs.,その会社は新しい工場を郊外に建設することに決めた。
418,aid,noun,1,5,を援助する，助ける（≒ help）,International aid is crucial for countries recovering from natural disasters.,自然災害から復興している国々にとって、国際援助は極めて重要である。
419,bite,verb,1,5,（を）かむ，（に）かみつく；（を）刺す,"Some insects can bite, causing itching or allergic reactions.",一部の昆虫は噛むことがあり、かゆみやアレルギー反応を引き起こすことがあります。
420,deliver,verb,1,5,を配達する；（演説・講義）をする；子を産む,The professor will deliver a lecture on ancient history tomorrow.,教授は明日、古代史についての講義を行います。
421,perceive,verb,1,5,に気づく；を知覚する；を理解する,The way we perceive challenges can determine whether we see them as obstacles or opportunities.,私たちが課題をどのように捉えるかによって、それが障害となるか機会となるかが決まる。
422,distinguish,verb,1,5,を区別する,It can be difficult to distinguish between genuine antique furniture and well-made reproductions without expert knowledge.,専門知識がなければ、本物のアンティーク家具と精巧に作られたレプリカを見分けるのは難しい場合があります。
423,imply,verb,1,5,を暗に意味する；を必然的に伴う,Her hesitant answer seemed to imply that she was not entirely sure about the plan.,彼女の曖昧な返事は、その計画について彼女が完全に確信しているわけではないことを暗に示しているようだった。
424,handle,verb,1,5,を処理する，扱う；を論じる；を商う,It's important to know how to handle stress effectively.,ストレスに効果的に対処する方法を知ることが大切です。
425,praise,verb,1,5,を（～のことで）賞賛する（for）；賛美する,The principal praised the students for their diligent efforts in organizing the school festival.,校長は、学園祭を企画する上での生徒たちの勤勉な努力を称賛した。
426,appeal,verb,1,5,訴える；抗議する；（上級審に）上訴する,The lawyer advised his client to appeal the court's verdict.,弁護士は依頼人に裁判所の評決を不服として上訴するよう助言した。
427,insist,verb,1,5,（を）強く主張する；要求する,"Despite the rain, she insisted on going for a walk in the park.",雨にもかかわらず、彼女は公園を散歩すると言い張った。
428,compete,verb,1,5,競う；〔通例否定文で〕（～に）匹敵する（with）,"In today's highly interconnected world, businesses must constantly innovate to compete effectively in the global market.",今日の高度に相互接続された世界では、企業はグローバル市場で効果的に競争するために、常に革新し続けなければなりません。
429,rank,verb,1,5,を位置づける，評価する；（ある地位に）位置する,Many universities rank applicants based on their academic performance and extracurricular activities.,多くの大学は、学業成績と課外活動に基づいて応募者の順位を付けます。
430,deny,verb,1,5,を否定する；を拒む,It's difficult to deny the impact of climate change.,気候変動の影響を否定するのは難しい。
431,reject,verb,1,5,を拒否する,The university decided to reject his application due to the late submission of required documents.,大学は、必要書類の提出が遅れたため、彼の願書を却下することに決定しました。
432,intend,verb,1,5,を意図する,The company intends to expand its operations into several new international markets next year.,その会社は来年、いくつかの新しい国際市場に事業を拡大することを意図している。
433,expose,verb,1,5,をさらす；を暴露する；を露出する,Many students were exposed to different cultures during their exchange program.,多くの学生は、交換留学中に様々な文化に触れました。
434,favor,verb,1,5,に賛成する；を好む；をひいきする,Many people favor sustainable practices to protect the environment.,多くの人々は、環境を保護するために持続可能な慣行を好んでいます。
435,inspire,verb,1,5,（人）を奮起させる；を喚起する,Her courageous story will inspire countless individuals to overcome their own challenges.,彼女の勇気ある話は、数えきれないほど多くの人々が自身の困難を乗り越えるきっかけとなるだろう。
436,propose,verb,1,5,を提案する；をもくろむ；結婚を申し込む,The government plans to propose new legislation to address climate change.,政府は気候変動に対処するため、新しい法案を提案する予定だ。
437,spell,verb,1,5,（語）をつづる；という語になる,Could you please spell your last name for me so I can enter it accurately into the system?,システムに正確に入力できるよう、苗字を綴っていただけますか？
438,breathe,verb,1,5,呼吸する；を吸う,"Even in the midst of chaos, it's important to remember to breathe deeply and remain calm.",混乱の最中であっても、深く呼吸し、冷静さを保つことを忘れないようにすることが大切だ。
439,repair,verb,1,5,を修理する（≒ fix）；を修復する,It took several skilled craftsmen weeks to fully repair the damage to the historic building after the earthquake.,地震の後、歴史的建造物が受けた損傷を完全に修復するのに、数人の熟練した職人が数週間を要した。
440,consist,verb,1,5,（～から）成る（of）；（～に）ある（in）,Our solar system consists of the Sun and eight planets.,私たちの太陽系は太陽と8つの惑星から成っています。
441,comment,noun,1,5,意見，コメント；批判,The professor's comments helped clarify the difficult concept.,教授のコメントは、その難しい概念を明確にするのに役立った。
442,instruction,noun,1,5,〔通例～s〕指示；〔～s〕（製品の）使用書,The detailed instructions provided with the new software were crucial for users to understand its complex features effectively.,新ソフトウェアに付属していた詳細な指示は、ユーザーがその複雑な機能を効果的に理解するために非常に重要でした。
443,religion,noun,1,5,宗教；信条；信仰（心）,"Despite differences in religion, people can often find common ground through shared values.",宗教の違いにもかかわらず、人々はしばしば共有された価値観を通して共通の基盤を見つけることができます。
444,neighborhood,noun,1,5,地域；近所,"Our neighborhood is a vibrant community with many small shops and a beautiful park, making it an ideal place to raise a family.",私たちの近所は、多くの小さなお店と美しい公園がある活気あるコミュニティで、家族を育てるのに理想的な場所です。
445,laboratory,noun,1,5,実験室，研究室,The new research laboratory at the university is equipped with state-of-the-art instruments for advanced scientific studies.,その大学の新しい研究室は、高度な科学研究のために最先端の機器を備えています。
446,presence,noun,1,5,存在；出席；面前,The professor's calming presence helped the nervous students relax before the exam.,教授の落ち着いた存在感が、試験前に緊張していた学生たちを安心させた。
447,confidence,noun,1,5,自信；信頼；秘密,"To succeed in any field, it is essential to have confidence in your own abilities.",どんな分野でも成功するには、自分の能力に自信を持つことが不可欠です。
448,harm,noun,1,5,害，損害,Smoking can cause serious harm to your health.,喫煙はあなたの健康に深刻な害をもたらす可能性があります。
449,instrument,noun,1,5,器具；楽器（≒ musical instrument）,"She learned to play several musical instruments, including the piano and violin.",彼女はピアノやバイオリンを含むいくつかの楽器を習いました。
450,category,noun,1,5,部類，区分；範疇,The applications are classified into three main categories based on the applicants' qualifications.,申請書は、応募者の資格に基づいて主要な3つのカテゴリに分類されます。
451,capital,noun,1,5,資本；首都；大文字（≒ capital letter）,"Tokyo is the capital of Japan, known for its vibrant culture and advanced technology.",東京は日本の首都であり、その活気ある文化と先進技術で知られています。
452,outcome,noun,1,5,結果（≒ result）；成果,The outcome of the experiment will determine the next steps in our research project.,実験の**結果**が、私たちの研究プロジェクトの次の段階を決定するでしょう。
453,notion,noun,1,5,概念，観念；見解；意向,Many people hold the notion that hard work always leads to success.,多くの人々は、努力すれば必ず成功するという考えを持っている。
454,review,verb,1,5,（書物などの）論評；再調査；【米】復習,"Before the final exam, students should thoroughly review their notes.",学生は期末試験の前に、ノートを徹底的に復習するべきです。
455,trait,noun,1,5,特性（≒ feature）,Diligence is a desirable trait for any student aiming to succeed in their studies.,勤勉さは、学業で成功を目指す学生にとって望ましい特性である。
456,diversity,noun,1,5,多様性；相違点,Universities often strive to increase the diversity of their student body to enrich the learning environment.,大学は、学習環境を豊かにするために、学生構成の多様性を増やすよう努めることが多いです。
457,victim,noun,1,5,犠牲（者），被害者,The organization provides support services for victims of domestic violence.,その組織は、家庭内暴力の被害者に対して支援サービスを提供しています。
458,occasion,noun,1,5,場合，時；行事；機会,The graduation ceremony was a memorable occasion for all the students and their families.,卒業式は、すべての生徒とその家族にとって思い出に残る行事でした。
459,facility,noun,1,5,施設，設備；機能；才能,The university is planning to build a new research facility to enhance its scientific studies.,大学は科学研究を強化するため、新しい研究施設を建設する予定です。
460,stock,noun,1,5,在庫品；蓄え；株,The company's stock prices plummeted after the scandal.,その会社の株価はスキャンダルの後、急落した。
461,conference,noun,1,5,会議；協議,The international conference on artificial intelligence was held in Tokyo.,人工知能に関する国際会議が東京で開催されました。
462,humanity,noun,1,5,人類；人間性；人情；〔（the） ～ties〕人文科学,The core of humanity lies in our ability to empathize with others.,人間性の本質は、他者に共感する能力にある。
463,dialect,noun,1,5,方言,"Each region in Japan boasts its own distinct dialect, which often reflects centuries of unique cultural and historical development.",日本の各地方は、それぞれ独自の明確な方言を誇っており、それはしばしば何世紀にもわたる独自の文化史的発展を反映しています。
464,proportion,noun,1,5,割合；部分；釣り合い,The government must ensure that the proportion of renewable energy sources in the national grid increases steadily to meet future demands.,政府は、将来の需要を満たすために、国の送電網における再生可能エネルギー源の割合が着実に増加することを確実にしなければならない。
465,tip,noun,1,5,助言，秘訣；チップ；先端,He gave me a valuable tip on how to prepare for the university entrance exam.,彼は大学入試の準備方法について貴重な助言をくれた。
466,lawyer,noun,1,5,弁護士,She decided to pursue a career as a lawyer after being deeply moved by a documentary on human rights issues.,彼女は人権問題に関するドキュメンタリーに深く感動した後、弁護士としてのキャリアを追求することを決意しました。
467,stuff,noun,1,5,（漠然と）物；素材；素質,He's got the right stuff to be a leader.,彼にはリーダーになる資質がある。
468,comfort,noun,1,5,快適さ；慰め,She found great comfort in the support of her friends during difficult times.,彼女は困難な時期に友人たちの支えに大きな慰めを見出した。
469,philosophy,noun,1,5,哲学；原理；人生観,The study of philosophy encourages critical thinking and a deeper understanding of existence.,哲学の研究は、批判的思考を促し、存在に関するより深い理解を育みます。
470,mammal,noun,1,5,哺乳動物,"Despite living in the ocean, whales are mammals, not fish, as they breathe air, are warm-blooded, and give birth to live young.",海に生息しているにもかかわらず、クジラは魚ではなく哺乳動物です。それは、空気を呼吸し、恒温動物であり、生きた子を産むという特徴を持つためです。
471,quantity,noun,1,5,量（⇔ quality ⇒ 69）；分量,The quality of ingredients often matters more than the sheer quantity when preparing a gourmet meal.,グルメな食事を作る際、単なる量よりも食材の質の方が重要となることが多い。
472,landscape,noun,1,5,風景；領域；状況,The rapidly changing technological landscape requires companies to constantly adapt and innovate.,急速に変化する技術的状況において、企業は絶えず適応し、革新することが求められる。
473,tribe,noun,1,5,部族；仲間,Many indigenous tribes around the world are struggling to preserve their traditional cultures amidst modernization.,世界中の多くの先住民族の部族が、近代化の波の中で彼らの伝統文化を守るために苦闘しています。
474,organ,noun,1,5,器官，臓器；組織；（パイプ）オルガン,"The human brain is an incredibly complex organ responsible for thought, memory, and controlling body functions.",人間の脳は、思考、記憶、身体機能の制御を司る、信じられないほど複雑な器官です。
475,trial,noun,1,5,試み，（品質・性能などの）試験；裁判；試用期間,Scientists conducted extensive trials to ensure the new vaccine's safety and effectiveness.,科学者たちは、新しいワクチンの安全性と有効性を確保するために、広範な試験を実施しました。
476,norm,noun,1,5,規範；標準,"In many cultures, shaking hands is a common social norm when meeting someone for the first time.",多くの文化では、初めて人に会うときに握手するのが一般的な社会規範です。
477,code,noun,1,5,規範；暗号；法典,All employees are expected to adhere to the company's strict code of conduct.,全従業員は、会社の厳格な行動規範を順守することが求められています。
478,substance,noun,1,5,物質；実体；趣旨,His argument lacked substance.,彼の議論には実体がなかった。
479,multiple,adjective,1,5,多様な；種々雑多な,Solving the problem required multiple steps.,問題を解決するには、複数の手順が必要だった。
480,numerous,adjective,1,5,非常に数の多い,"The library has numerous books on various subjects, making it a valuable resource for students.",図書館には様々な科目の本が数多くあり、学生にとって貴重な情報源となっています。
481,narrow,adjective,1,5,狭い；細い；限られた,"The new policy faced narrow support, indicating a significant division within the committee.",その新しい政策はわずかな支持しか得られず、委員会内の大きな意見の相違を示していた。
482,widespread,adjective,1,5,広範囲にわたる；広く普及した,There is widespread concern about the impact of artificial intelligence on society.,人工知能が社会に与える影響について、広範囲にわたる懸念が広がっています。
483,sufficient,adjective,1,5,（～に；...するのに）十分な（for；to do）,The available evidence was not sufficient to prove his guilt.,利用可能な証拠は、彼の有罪を証明するのに十分ではなかった。
484,proper,adjective,1,5,適切な；正式の；〔名詞の後ろで〕主要な；（～に）固有の（to）,It is important to follow the proper procedures when applying for a visa.,ビザを申請する際には、適切な手続きに従うことが重要です。
485,linguistic,adjective,1,5,言語の，言語学の,The new theory provides novel insights into the linguistic mechanisms underlying human language acquisition.,新しい理論は、人間の言語習得の根底にある言語的メカニズムに新たな洞察をもたらす。
486,annual,adjective,1,5,年1回の，例年の；1年間の,The university's annual entrance examination attracts thousands of applicants.,大学の例年の入学試験には、何千人もの志願者が集まります。
487,contemporary,adjective,1,5,現代の；同時代の；同年輩の,Many art critics consider her work to be among the most influential contemporary pieces of the decade.,多くのアート評論家は、彼女の作品をこの10年で最も影響力のある現代作品の一つだと考えている。
488,contrary,adjective,1,5,（～と）反対の（to）,"The company's new policy was contrary to the interests of its employees, leading to widespread dissatisfaction.",その会社の新しい方針は従業員の利益に反しており、広範な不満を引き起こした。
489,strict,adjective,1,5,（規則などが）厳しい；厳格な,My parents have strict rules regarding my curfew.,私の両親は門限に関して厳しい規則があります。
490,civil,adjective,1,5,市民の；民間の；民事の（⇔ criminal 刑事の）,"A strong civil society is essential for a healthy democracy, allowing citizens to participate actively.",強固な市民社会は健全な民主主義に不可欠であり、市民が積極的に参加することを可能にする。
491,odd,adjective,1,5,奇妙な（≒ strange）；奇数の,"It's odd that he hasn't called yet, considering he usually calls by this time.",彼がこの時間にはいつも電話をかけてくることを考えると、まだ電話がないのは奇妙だ。
492,unknown,adjective,1,5,不明の；（～に）知られていない（to），無名の,"The exact cause of the phenomenon remains unknown, despite extensive research.",その現象の正確な原因は、広範な研究にもかかわらず、いまだ不明のままである。
493,superior,adjective,1,5,よりすぐれた（⇔ inferior ⇒ 1092）,The new smartphone boasts a superior camera and longer battery life than its rivals.,新しいスマートフォンは、競合他社よりも優れたカメラとより長いバッテリー寿命を誇っています。
494,sensitive,adjective,1,5,敏感な；神経質な；微妙な,It's important to be sensitive to cultural differences when traveling abroad.,海外を旅行する際には、文化的な違いに敏感であることが重要です。
495,violent,adjective,1,5,（人・気質などが）激しい；暴力的な,Exposure to violent content in media can have a detrimental effect on young people's behavior.,メディアにおける暴力的な内容への接触は、若者の行動に有害な影響を及ぼす可能性があります。
496,virtual,adjective,1,5,仮想の；事実上の,"The company organized a virtual conference, allowing participants from various countries to attend without the need for physical travel.",その会社はバーチャル会議を開催し、様々な国からの参加者が物理的に移動することなく参加できるようにしました。
497,regardless,adverb,1,5,（～に）かまわない，無頓着な（of）,"The show will go on, regardless of the weather.",天候にかかわらず、ショーは開催されます。
498,immediate,adjective,1,5,即座の；当面の；すぐそばの；直接の,The government must take immediate action to address the climate change crisis.,政府は気候変動の危機に対処するため、即座の行動を取らなければならない。
499,crucial,adjective,1,5,重要な,Developing strong critical thinking skills is crucial for success in higher education.,高等教育で成功するためには、強力な批判的思考スキルを身につけることが極めて重要です。
500,somewhat,adverb,1,5,いくぶん，多少,The results of the experiment were somewhat disappointing.,実験の結果は、いくぶん残念なものでした。
501,interpret,verb,1,6,を解釈する；（を）通訳する,Historians often need to interpret ancient texts and artifacts to reconstruct past events accurately.,歴史家は、過去の出来事を正確に再構築するために、しばしば古代の文書や遺物を解釈する必要があります。
502,translate,verb,1,6,を翻訳する；を（～に）変える（into）,You need to understand the cultural context to accurately translate a poem from Japanese into English.,詩を日本語から英語に正確に翻訳するためには、文化的な文脈を理解する必要があります。
503,concentrate,verb,1,6,（を）集中する,"To perform well on the exam, you need to concentrate fully on understanding the key concepts.",試験で良い成績を収めるためには、重要な概念を完全に理解することに集中する必要があります。
504,request,noun,1,6,に（...するように）頼む（to do）；を要請する,The student submitted a formal request to the dean for a leave of absence due to family circumstances.,その学生は、家庭の事情により休学を願い出る正式な要請を学部長に提出した。
505,criticize,verb,1,6,を批判する；を批評する,The government's decision to cut funding for education was heavily criticized by teachers and parents alike.,政府の教育への資金削減という決定は、教師と保護者双方から厳しく批判された。
506,overcome,verb,1,6,を克服する,"To succeed in any field, one must learn to overcome challenges and adapt to new circumstances.",どの分野で成功するにしても、課題を克服し、新しい状況に適応することを学ぶ必要がある。
507,obtain,verb,1,6,を得る,He worked diligently to obtain the necessary qualifications for his dream job.,彼は夢の仕事に必要な資格を取得するために、懸命に努力した。
