id,word,pos,part,section,japanese,sentence,sentence_ja
1408,retrieve,verb,2,15,（情報）を検索する；を取り戻す；を回復する,The technician was able to retrieve all the lost data from the damaged hard drive.,技術者は、損傷したハードドライブから失われたすべてのデータを回復することができました。
1409,portray,verb,2,15,を描く；（の役）を演じる,The film aims to portray the historical events accurately.,その映画は、歴史上の出来事を正確に描写することを目指している。
1410,scratch,verb,2,15,を引っかく；を取り消す，削除する,Students should scratch out any mistakes clearly and write the correct answers above them.,学生はどんな間違いも明確に線で消し、その上に正しい答えを書きなさい。
1411,designate,verb,2,15,を指定する；を任命する,The committee will designate a new chairperson next month.,委員会は来月、新しい議長を指名するでしょう。
1412,contradict,verb,2,15,と矛盾する；に反対意見を言う,His actions often contradict his words.,彼の行動はしばしば彼の言葉と矛盾する。
1413,sigh,noun,2,15,ため息をつく,"After hours of studying, she let out a deep sigh of exhaustion as she finally closed the textbook.",何時間も勉強した後、ついに教科書を閉じた時、彼女は深い疲労のため息をついた。
1414,disrupt,verb,2,15,を混乱させる；を分裂させる,The unexpected power outage significantly disrupted the school's daily schedule.,予期せぬ停電が、学校の日常の予定を大幅に混乱させた。
1415,depart,verb,2,15,出発する；（～から）それる（from）,Passengers should arrive at the gate at least 30 minutes before their flight is scheduled to depart.,乗客は、フライトが出発する予定時刻の少なくとも30分前までに搭乗口に到着している必要があります。
1416,navigate,verb,2,15,（を）誘導する；（を）操縦する；（を）航行する,"In today's digital age, students must learn how to effectively navigate the vast amount of information available online.",現代のデジタル時代において、学生はオンライン上の膨大な情報を効果的に扱う方法を学ぶ必要があります。
1417,beg,verb,2,15,に（～を）切に頼む（for）；（を）懇願する,"She begged him to forgive her, tears streaming down her face.",彼女は、涙を流しながら、彼に許してくれるよう懇願した。
1418,inhabit,verb,2,15,に住んでいる；に宿る，存する,"Many different species of animals inhabit the Amazon rainforest, demonstrating the incredible biodiversity of the region.",多くの異なった種類の動物がアマゾン熱帯雨林に生息しており、その地域の信じられないほどの生物多様性を示している。
1419,diagnose,verb,2,15,（を）診断する,"Medical professionals often rely on a combination of patient history, physical examinations, and laboratory tests to accurately diagnose complex conditions.",医療従事者は、複雑な病状を正確に診断するために、患者の病歴、身体診察、および臨床検査といった要素の組み合わせに頼ることがよくあります。
1420,comprehend,verb,2,15,を理解する,Many students find it challenging to fully comprehend complex philosophical concepts without ample opportunity for discussion and critical analysis.,多くの学生は、議論や批判的分析の十分な機会なしに、複雑な哲学的概念を完全に理解するのは難しいと感じています。
1421,oblige,verb,2,15,に義務づける；に恩恵を施す,I would be much obliged if you could send me the report by Friday.,金曜日までにそのレポートを送っていただけると、大変ありがたく存じます。
1422,cram,verb,2,15,に詰め込む；詰め込み勉強をする,"Many students tend to cram for their university entrance exams the night before, hoping to retain a large amount of information quickly.",多くの学生は、大量の情報を素早く覚えるために、大学入試の前夜に詰め込み勉強をする傾向があります。
1423,flock,verb,2,15,群がる，集まる,Tourists often flock to Kyoto during the cherry blossom season.,観光客は桜の季節になると、よく京都に押し寄せます。
1424,underestimate,verb,2,15,（を）過小評価する（⇔ overestimate （を）過大評価する）；（を）軽く見る；を少なく見積もる,Many people underestimate how difficult it is to learn a new language.,多くの人は、新しい言語を学ぶことの難しさを過小評価している。
1425,clarify,verb,2,15,を明確にする,The manager asked me to clarify the details of the project proposal before submitting it to the client.,マネージャーは、クライアントに提出する前に、企画書の詳細を明確にするよう私に求めました。
1426,spark,verb,2,15,を引き起こす；を刺激する；スパークする,The new policy sparked widespread debate among the public.,新しい政策は、国民の間で広範な議論を巻き起こした。
1427,seize,verb,2,15,をつかむ；を奪い取る；を没収する,It is crucial to seize every opportunity that comes your way if you wish to achieve your ambitions.,野望を達成したいのであれば、巡ってくるあらゆる機会をつかむことが極めて重要です。
1428,soar,verb,2,15,急上昇する；空高く飛ぶ,"As the economic indicators improved, consumer confidence began to soar, signaling a potential recovery.",経済指標が改善するにつれて、消費者信頼感は急上昇し始め、景気回復の兆しを見せました。
1429,glow,noun,2,15,光り［照り］輝く；赤く燃える；紅潮する,"The artist captured the subtle glow of the sunset on the horizon, creating a sense of tranquil beauty.",芸術家は水平線に沈む夕日の微かな輝きを捉え、静謐な美しさを生み出した。
1430,disguise,verb,2,15,を（～に）変装させる（as）；を偽る,"He tried to disguise his disappointment with a brave smile, but his eyes betrayed his true feelings.",彼は努めて笑顔を作って落胆を偽ろうとしたが、彼の目は本当の気持ちを裏切っていた。
1431,distort,verb,2,15,を歪める；歪む,"It is important to be careful when interpreting statistics, as they can easily be distorted to support different arguments.",統計は、異なる主張を支持するために容易に歪められる可能性があるため、解釈する際には注意が必要である。
1432,undermine,verb,2,15,を徐々にむしばむ；を侵食する,Constant rumors and gossip can gradually undermine a leader's authority and reputation.,絶え間ない噂や陰口は、リーダーの権威と評判を徐々にむしばむ可能性があります。
1433,abolish,verb,2,15,を廃止する（≒ do away with）,Many activists campaigned for years to abolish the death penalty.,多くの活動家が長年、死刑を廃止するために運動しました。
1434,strip,verb,2,15,を［から］取り去る；を裸にする,The workers had to strip the old wallpaper from the walls before repainting the room.,作業員たちは部屋を塗り替える前に、壁から古い壁紙を剥がさなければならなかった。
1435,dispose,verb,2,15,〔dispose ofで〕を処分する；を（...する）気にさせる（to do）；を配置する,It is important to dispose of hazardous waste properly.,有害廃棄物を適切に処分することが重要だ。
1436,dump,verb,2,15,を投棄する；をどさっと落とす,The company had to dump its excess inventory at a reduced price.,会社は、余剰在庫を値下げして処分しなければならなかった。
1437,weave,verb,2,15,を織る；（計画・物語など）を作り上げる,"The experienced director managed to weave several distinct storylines into a single, cohesive film.",経験豊富な監督は、いくつかの異なる物語の筋を、一つのまとまりのある映画にまとめ上げた。
1438,refine,verb,2,15,を洗練する；を精製する,Engineers continue to refine the design of the new engine to improve fuel efficiency.,技術者たちは、燃費を向上させるために新しいエンジンの設計を洗練させ続けている。
1439,enrich,verb,2,15,を豊かにする；（物質）を濃縮化する,Reading books can significantly enrich your vocabulary and general knowledge.,読書は、あなたの語彙力と一般知識を大いに豊かにすることができます。
1440,coordinate,verb,2,15,を調整する；を組織する；（服など）をコーディネートする,The team needs to coordinate their efforts to finish the project on time.,チームはプロジェクトを期限内に終えるために、彼らの努力を調整する必要がある。
1441,headline,noun,2,15,（新聞などの）見出し,It's important to read beyond just the headline to understand the full story.,記事の全容を理解するためには、見出しだけではなく、その内容まで読むことが大切です。
1442,internship,noun,2,15,【米】 実務［医学］研修；研修期間,The university offers various internship programs to help students gain practical experience before entering the workforce.,その大学は、学生が社会に出る前に実務経験を積むのを助けるために、様々なインターンシッププログラムを提供しています。
1443,outlet,noun,2,15,直売店，特売店；はけ口；【米】（電気の）コンセント（≒ 【英】socket）,I need to find an available outlet to charge my phone.,携帯電話を充電するために、空いているコンセントを見つける必要があります。
1444,remedy,noun,2,15,治療（法）；治療薬；解決法,The government is seeking a lasting remedy for the unemployment problem.,政府は失業問題に対する根本的な解決法を模索している。
1445,pill,noun,2,15,錠剤，丸薬；〔the ～〕ピル，経口避妊薬,It is important to follow the doctor's instructions carefully when taking any prescribed pill.,処方された薬を服用する際は、医師の指示に注意深く従うことが重要です。
1446,reception,noun,2,15,反応；宴会；受付；受信（状態）,The new employee received a warm reception from her colleagues.,新入社員は同僚から温かい歓迎を受けた。
1447,transaction,noun,2,15,（商）取引；（人と人との）交流,Every successful online transaction requires secure payment processing.,すべての成功したオンライン取引には、安全な支払い処理が必要です。
1448,mutation,noun,2,15,突然変異（体）；変化,"Random mutations in an organism's DNA are the fundamental source of genetic variation, driving evolutionary change.",生物のDNAに生じる無作為の突然変異は、遺伝的変異の根本的な源であり、進化的変化を促す。
1449,dairy,noun,2,15,〔集合的に〕乳製品；乳製品加工所［販売者］,Some people avoid dairy due to lactose intolerance.,乳糖不耐症のため、乳製品を避ける人もいます。
1450,compassion,noun,2,15,同情,"Known for his deep compassion, the veteran physician always took the time to listen intently to his patients' concerns and fears.",深い同情心で知られるそのベテラン医師は、いつも時間をかけて患者たちの懸念や不安に熱心に耳を傾けた。
1451,posture,noun,2,15,姿勢；心構え,Maintaining good posture is crucial not only for physical well-being but also for projecting an image of confidence.,良い姿勢を保つことは、身体的な健康だけでなく、自信があるという印象を与える上でも非常に重要です。
1452,curse,noun,2,15,悪態，ののしりの言葉；呪い；〔通例a ～〕災い,The ancient artifact was said to carry a powerful curse.,その古代の遺物は強力な呪いを帯びていると言われていた。
1453,funeral,noun,2,15,葬式,The entire community gathered for the funeral service to pay their respects to the deceased and offer support to the grieving family.,地域全体が、故人に敬意を表し、遺族を支えるために、葬式に集まりました。
1454,census,noun,2,15,国勢調査；交通調査,The government conducts a national census every ten years to gather essential demographic data and inform future policy decisions.,政府は、重要な人口統計データを収集し、将来の政策決定に役立てるために、10年ごとに国勢調査を実施しています。
1455,encyclopedia,noun,2,15,百科事典,The advent of the internet has significantly changed how students use encyclopedias for research.,インターネットの登場は、学生が研究目的で百科事典を利用する方法を大幅に変えました。
1456,cereal,noun,2,15,〔通例～s〕穀物；シリアル（穀物加工食品）,"Many people prefer to start their day with a bowl of cereal, often accompanied by milk and fruit.",多くの人は、牛乳や果物を添えて食べることが多いシリアルで一日を始めるのを好みます。
1457,fragment,noun,2,15,断片,Archaeologists often piece together our understanding of ancient civilizations from mere fragments of pottery and writings.,考古学者は、土器や書物のわずかな断片から、古代文明に対する我々の理解をしばしば再構築します。
1458,patch,verb,2,15,（～の）部分，斑点；継ぎ；貼り薬,The tailor managed to patch the tear in the coat almost invisibly.,仕立て屋は、コートの破れ目をほとんど見えないように繕うことができた。
1459,rubbish,noun,2,15,【英】 ごみ（≒ 【米】garbage）；つまらないもの,That reality show is complete rubbish; I can't believe people watch it.,あのリアリティ番組は全くくだらない。人々がそれを見ているなんて信じられない。
1460,maze,noun,2,15,迷路（≒ labyrinth）；複雑に込み入ったもの,Navigating the bureaucratic maze to get the permit approved proved to be an arduous task.,許可を得るために官僚機構の迷路を乗り越えることは、大変骨の折れる仕事だと判明した。
1461,outlook,noun,2,15,見解；見通し；眺め,Having a positive outlook can greatly influence how you deal with challenges.,前向きな見方を持つことは、課題にどう対処するかに大きく影響を与えます。
1462,breakthrough,noun,2,15,大発見，飛躍的進歩,Scientists are hoping for a major breakthrough in cancer research.,科学者たちは、がん研究における画期的な進歩を期待しています。
1463,triumph,noun,2,15,勝利；勝利の喜び；偉業,Winning the championship was a great triumph for the team.,選手権で優勝することは、チームにとって大きな勝利でした。
1464,ally,noun,2,15,同盟国；提携者；援助者；盟友,The nation sought to strengthen its diplomatic ties with its traditional allies to maintain regional stability.,国は地域の安定を維持するため、伝統的な同盟国との外交関係の強化を図った。
1465,spectator,noun,2,15,（試合などの）観客,The stadium was filled with thousands of excited spectators cheering for their favorite team.,スタジアムは、お気に入りのチームを応援する何千人もの興奮した観客で埋め尽くされていた。
1466,sphere,noun,2,15,領域；球体；天体,"In recent decades, the digital realm has expanded to become a crucial sphere of human interaction.",ここ数十年で、デジタル領域は拡大し、人間の交流にとって不可欠な分野となりました。
1467,county,noun,2,15,【米】 郡；【英】州,She lives in a rural county in the south of England.,彼女はイングランド南部の田舎の郡に住んでいます。
1468,behalf,noun,2,15,利益，味方,I would like to thank you on behalf of the entire team for your hard work.,皆様の尽力に感謝し、チーム全体を代表してお礼を申し上げます。
1469,interval,noun,2,15,（時間の）間隔；合間；隔たり；小休止,It is important to take short intervals of rest when studying for long hours to maintain focus.,長時間勉強する際には、集中力を維持するために短い休息の間隔を取ることが重要です。
1470,circulation,noun,2,15,循環；流通；（新聞・雑誌の）発行部数,The newspaper's circulation has declined significantly over the past decade.,その新聞の発行部数は、過去10年間で大幅に減少している。
1471,blade,noun,2,15,刃；（プロペラなどの）羽根；（草などの）葉,The sharp blade of the knife allowed him to slice the vegetables with precision.,ナイフの鋭い刃により、彼は野菜を正確にスライスすることができた。
1472,theft,noun,2,15,窃盗（罪）,The recent increase in petty theft in urban areas has become a significant concern for local authorities.,都市部における最近の軽窃盗の増加は、地方当局にとって大きな懸念となっている。
1473,vacuum,noun,2,15,真空；空虚,The vastness of space is often described as a near-perfect vacuum.,宇宙の広大さは、しばしばほぼ完全な真空と表現されます。
1474,collision,noun,2,15,衝突；対立,The upcoming meeting is expected to result in a collision of opposing viewpoints.,今度の会議では、対立する意見の衝突が生じると予想されている。
1475,bargain,noun,2,15,買い得品；取引；契約,"This high-quality smartphone was an absolute bargain, costing only half of its original price.",この高品質なスマートフォンは、元の価格の半分しかかからなかったので、まさに破格の買い物でした。
1476,landmark,noun,2,15,（ある場所の）目印；画期的な出来事,The signing of the peace treaty was considered a landmark in the history of the two nations.,平和条約の調印は、二国間の歴史における画期的な出来事と見なされた。
1477,revenue,noun,2,15,歳入（⇔ expenditure 歳出）；収益,"The tech giant's quarterly revenue exceeded analysts' expectations, driven by strong sales of its new smartphone model.",その巨大IT企業の四半期ごとの収益は、新型スマートフォンモデルの好調な売上によって牽引され、アナリストの予想を上回った。
1478,treaty,noun,2,15,（国家間の）条約；協定,International treaties play a crucial role in maintaining global peace and security.,国際条約は世界の平和と安全を維持する上で、重要な役割を果たしています。
1479,supreme,adjective,2,15,最高の,Achieving harmony among different cultures is a supreme challenge for humanity.,異なる文化間の調和を達成することは、人類にとって最高の課題である。
1480,thorough,adjective,2,15,徹底的な；まったくの,The police conducted a thorough investigation into the cause of the accident.,警察は事故の原因について徹底的な調査を行った。
1481,naked,adjective,2,15,裸の,"The trees stood naked against the winter sky, having lost all their leaves.",冬の空を背景に、木々は葉を全て落として裸の姿で立っていた。
1482,sincere,adjective,2,15,心からの；誠実な,A sincere apology can often mend a broken relationship.,心からの謝罪は、しばしば傷ついた関係を修復することができます。
1483,tame,adjective,2,15,飼いならされた，人に慣れた；退屈な,The movie's plot was so tame that it failed to keep the audience engaged.,その映画の筋書きはあまりに退屈だったので、観客の関心を引きつけ続けることができなかった。
1484,insufficient,adjective,2,15,不十分な；不適当な,"Due to insufficient funds, the company had to delay the launch of its new product.",資金不足のため、その会社は新製品の発売を延期しなければならなかった。
1485,dim,adjective,2,15,薄暗い；ぼんやりした,"In the dim light of the ancient library, she struggled to read the fine print.",古びた図書館の薄暗い光の中で、彼女は細かい活字を読むのに苦労した。
1486,acute,adjective,2,15,（痛み・感情などが）激しい；（知覚などが）鋭い；急性の（⇔ chronic ⇒ 1198）,The country is facing an acute shortage of medical supplies due to the pandemic.,その国はパンデミックのため、医療物資の深刻な不足に直面している。
1487,disabled,adjective,2,15,障害のある；障害者用の,The university aims to create an inclusive environment where disabled students can thrive.,大学は、障害のある学生が活躍できるインクルーシブな環境を創り出すことを目指しています。
1488,metropolitan,adjective,2,15,大都市の，首都圏の,The city offers a wide range of cultural activities typical of a metropolitan area.,その都市は、大都市圏に典型的な多岐にわたる文化活動を提供しています。
1489,monetary,adjective,2,15,金銭的な；金融の,The central bank announced new monetary policies to stimulate the economy.,中央銀行は、経済を活性化させるために新たな金融政策を発表した。
1490,alternate,adjective,2,15,代わりの（≒ alternative）；交互の,Students attend classes on alternate days to maintain social distancing.,生徒たちは、ソーシャルディスタンスを保つため、隔日で授業に出席します。
1491,partial,adjective,2,15,部分的な；不公平な（⇔impartial 公平な）,"The architect presented a partial design for the new building, expecting feedback before completing the final plans.",建築家は、最終的な計画を完成させる前に意見をもらうことを期待して、新しい建物の部分的なデザインを提示しました。
1492,divine,adjective,2,15,神の；神にささげる,The ancient Greeks believed that certain mountains were home to divine beings.,古代ギリシャ人は、特定の山々が神々の住処であると信じていました。
1493,drastic,adjective,2,15,徹底的な，抜本的な；極端な,The company had to make drastic changes to avoid bankruptcy.,会社は倒産を避けるために抜本的な変更をする必要があった。
1494,fierce,adjective,2,15,猛烈な；どう猛な,She has a fierce determination to succeed in her chosen career.,彼女には、選んだキャリアで成功しようとする猛烈な決意がある。
1495,sole,adjective,2,15,唯一の；単独の；独占的な,The sole purpose of the meeting was to discuss the new project.,会議の唯一の目的は、新しいプロジェクトについて話し合うことでした。
1496,spontaneous,adjective,2,15,自然発生的な；自発的な,The audience gave a spontaneous round of applause after the powerful performance.,力強い演技の後、聴衆は自発的に拍手喝采を送った。
1497,spatial,adjective,2,15,空間の,Children often develop their spatial reasoning skills by playing with building blocks.,子供たちは、積み木遊びを通して空間認識能力を育むことが多いです。
1498,neat,adjective,2,15,きちんとした；見事な,He keeps his desk remarkably neat despite his busy schedule.,彼は忙しいスケジュールにもかかわらず、机を驚くほどきれいに保っている。
1499,tidy,adjective,2,15,きちんとした，整頓された；相当の,"She always keeps her desk tidy and organized, which helps her focus on her work.",彼女はいつも机をきちんとして整理整頓しており、それが仕事に集中するのに役立っている。
1500,loyal,adjective,2,15,（～に）忠実な（to）；誠実な,She remained loyal to her principles despite the pressure to compromise.,彼女は妥協を迫るプレッシャーにもかかわらず、自分の主義に忠実であり続けた。
1501,bless,verb,3,16,に恩恵を与える；に感謝する,This area is blessed with natural beauty.,この地域は自然の美しさに恵まれている。
1502,regain,verb,3,16,を取り戻す,"She fainted, but soon regained consciousness.",彼女は失神したが、すぐに意識を取り戻した。
1503,conform,verb,3,16,順応する；一致する,"While in Japan, Lucas tried to conform to Japanese customs.",日本にいる間、ルーカスは日本の慣習に順応しようとした。
1504,enroll,verb,3,16,登録する，入会する,He enrolled in a local gym to learn Latin dance.,彼はラテンダンスを習うために地元のジムに入会した。
1505,entitle,verb,3,16,に権利を与える；に題名をつける,Members of the store are entitled to a five percent discount.,その店の会員は5%の割引を受ける権利がある。
1506,halt,verb,3,16,を止める；止まる,The specialists were not able to halt the spread of this year's flu.,専門家たちは今年のインフルエンザの蔓延を食い止めることができなかった。
1507,provoke,verb,3,16,（感情・行動など）を引き起こす；を挑発する,The topic of immigration usually provokes emotional reactions.,移民の話題はたいてい感情的な反応を引き起こす。
