id,word,pos,part,section,japanese,sentence,sentence_ja
911,pronounce,verb,2,10,を発音する；を宣言する,It can be challenging for non-native speakers to correctly pronounce certain English words with subtle sound distinctions.,非ネイティブスピーカーが微妙な音の違いを持つ特定の英単語を正しく発音するのは難しい場合があります。
912,shrink,verb,2,10,縮む，縮小する；減少する；ひるむ,Many natural fibers tend to shrink when exposed to high heat during washing.,多くの天然繊維は、洗濯時に高熱にさらされると縮む傾向があります。
913,restore,verb,2,10,を回復させる；を修復する,Regular exercise can help to restore one's health and vitality.,定期的な運動は、健康と活力を回復させるのに役立ちます。
914,trigger,verb,2,10,を引き起こす；のきっかけとなる,The announcement of the new policy is expected to trigger significant changes in the industry.,新しい政策の発表は、業界に大きな変化を引き起こすと予想されている。
915,grab,verb,2,10,をつかむ；を横取りする；を急いで食べる,He quickly reached out to grab the falling vase before it hit the floor.,彼は花瓶が床に落ちる前に、急いで手を伸ばして掴んだ。
916,retain,verb,2,10,を保持する；を覚えている,It is important for students to develop effective study habits to retain information learned in class.,学生が授業で学んだ情報を保持するためには、効果的な学習習慣を身につけることが重要です。
917,reproduce,verb,2,10,を複製する；を繁殖させる；繁殖する,"All living organisms have the ability to reproduce, ensuring the continuation of their species.",すべての生物は、種の存続を確実にするために、繁殖する能力を持っている。
918,bob,verb,2,10,上下に動く；急に動く；を上下に動かす,"The cork bobbed on the surface of the water, indicating a fish might be nibbling at the bait.",コルクは水面で上下に揺れており、魚が餌をつついている可能性を示していた。
919,entertain,verb,2,10,を楽しませる；をもてなす,The magician's clever tricks thoroughly entertained the audience throughout the show.,手品師の巧妙なトリックは、ショーの間中ずっと観客を大いに楽しませた。
920,interfere,verb,2,10,干渉する，介入する；邪魔する,The new regulations might interfere with the company's expansion plans.,新しい規制は、その会社の拡張計画を妨げるかもしれません。
921,cultivate,verb,2,10,を養う；を耕す；を栽培する,It is important for students to cultivate a strong work ethic from an early age.,生徒たちが幼い頃から強い労働倫理を養うことは重要です。
922,underlie,verb,2,10,の根底にある,The cultural values that underlie a society's traditions are often passed down through generations.,社会の伝統の根底にある文化的価値観は、しばしば世代を超えて受け継がれる。
923,anticipate,verb,2,10,を予期する；楽しみに待つ,The company anticipates a strong recovery in sales next year due to new product launches.,その会社は、新製品の発売によって来年の売上が大幅に回復すると見込んでいる。
924,justify,verb,2,10,を正当化する,"It can be difficult to justify the high costs of certain luxury goods, especially when more affordable alternatives exist.",特に手頃な代替品が存在する場合、特定の高級品の高額な費用を正当化するのは難しいことがある。
925,regulate,verb,2,10,を規制する；を調整する,The government implemented new policies to regulate the emission of greenhouse gases.,政府は温室効果ガスの排出を規制するために、新しい政策を実施した。
926,scan,verb,2,10,を走査［スキャン］する；をざっと見る；を注意深く調べる,"Before submitting the essay, students should scan their work for any grammatical errors.",エッセイを提出する前に、学生は文法的な誤りがないか自分の作品を見直すべきです。
927,classify,verb,2,10,を分類する；を機密扱いにする,Researchers classify living organisms into various categories based on their shared characteristics.,研究者たちは、共通の特性に基づいて、生物を様々なカテゴリーに分類する。
928,submit,verb,2,10,を提出する；〔submit oneselfで〕（～に）従う（to）,Applicants must submit their documents online before the deadline.,志願者は締め切りまでに、オンラインで書類を提出しなければなりません。
929,pause,verb,2,10,（一時的に）中止する；（一瞬）立ち止まる,The speaker had to pause frequently during his presentation to consult his notes.,講演者は、自分のメモを確認するために、プレゼンテーション中に頻繁に一時停止しなければならなかった。
930,lean,verb,2,10,傾く；寄りかかる；をもたせかける,"If you feel dizzy, please lean on the railing for support.",もしめまいがするようでしたら、支えとして手すりに寄りかかってください。
931,bump,verb,2,10,ぶつかる；をぶつける,He accidentally bumped his head on the low beam as he stood up.,彼は立ち上がった時、誤って低い梁に頭をぶつけてしまった。
932,fold,verb,2,10,を折り畳む；（両腕）を組む；（折り）畳める,He carefully folded the map so that it would fit back into his pocket.,彼は地図を注意深く折り畳み、ポケットに再び収まるようにした。
933,hesitate,verb,2,10,躊躇する，ためらう,Don't hesitate to ask for help if you encounter any difficulties during the project.,プロジェクト中に何か困難に遭遇した場合は、遠慮なく助けを求めてください。
934,pump,verb,2,10,（液体・気体）をポンプで送り込む；をくみ出す；を注ぎ込む,The heart's main function is to pump blood throughout the body.,心臓の主な機能は、血液を全身に送り出すことです。
935,mount,verb,2,10,を据えつける；に着手する；（自転車など）に乗る；増える,The organization decided to mount a large-scale fundraising campaign to support the disaster victims.,その組織は、被災者を支援するため大規模な募金活動に着手することを決定した。
936,exceed,verb,2,10,を超える；に勝る,The demand for the new smartphone far exceeded the company's initial production capacity.,新しいスマートフォンの需要は、会社の当初の生産能力をはるかに上回った。
937,undergo,verb,2,10,を経験する；（手術など）を受ける；に耐える,The company is planning to undergo a major restructuring to improve its efficiency.,その会社は効率を改善するために大規模な組織再編を行う予定です。
938,confront,verb,2,10,に立ち向かう；（困難などが）に立ちはだかる,It's important to confront your fears to overcome them.,自分の恐れを克服するためには、それらに立ち向かうことが大切です。
939,consult,verb,2,10,（に）相談する；を参照する,You should consult a doctor if your symptoms worsen.,症状が悪化するなら、医者に診てもらうべきです。
940,fulfill,verb,2,10,を実現させる；を果たす；を満たす,She worked diligently to fulfill her lifelong dream of becoming a successful artist.,彼女は、成功した芸術家になるという生涯の夢を実現させるため、熱心に努力した。
941,privilege,noun,2,10,特権，特典,It is a great privilege to study at such a prestigious university.,このような名門大学で学ぶことは、大変な特権です。
942,formation,noun,2,10,形成；構成（物）；隊列,The careful formation of the government's new policy was crucial for its successful implementation.,政府の新たな政策の慎重な形成は、その成功裡の実施にとって極めて重要であった。
943,dimension,noun,2,10,側面，局面；次元；寸法,The new policy introduced several new dimensions to the ongoing debate about education reform.,その新しい政策は、教育改革に関する現在の議論にいくつかの新たな側面をもたらした。
944,neuron,noun,2,10,ニューロン，神経単位,Understanding how individual neurons communicate is crucial for advancing our knowledge of the brain.,個々のニューロンがどのように情報を伝達するかを理解することは、脳に関する我々の知識を進歩させる上で極めて重要である。
945,sensation,noun,2,10,感覚；大評判,The young artist became an international sensation after her debut exhibition received critical acclaim.,その若い芸術家は、デビュー展が絶賛されたことで、国際的なセンセーションを巻き起こした。
946,chart,noun,2,10,図，グラフ；海図；ヒットチャート,The company's sales chart clearly illustrated the significant growth in revenue over the past quarter.,その会社の売上グラフは、過去1四半期における収益の著しい成長を明確に示していた。
947,geography,noun,2,10,〔the ～〕地理；地理学,The study of geography helps us understand the complex interactions between human societies and the natural environment.,地理学の研究は、人間社会と自然環境の間の複雑な相互作用を私たちが理解するのに役立ちます。
948,panel,noun,2,10,（専門家の）一団；討論者一同；羽目板,The university invited a panel of experts to discuss the future of artificial intelligence.,大学は人工知能の未来について議論するため、専門家の一団を招いた。
949,semester,noun,2,10,【主に米】 （2学期制の）学期,"Many universities in Japan operate on a two-semester system, with breaks in between.",日本の多くの大学は、その間に休暇を挟む2学期制を採用しています。
950,workforce,noun,2,10,労働人口，総労働力；全従業員（数）,An aging workforce presents significant challenges for many developed countries.,高齢化する労働人口は、多くの先進国にとって深刻な課題となっています。
951,mill,noun,2,10,製造工場；製粉所；粉ひき機,The old textile mill was converted into apartments last year.,その古い紡績工場は昨年、アパートに改築された。
952,abuse,verb,2,10,乱用；虐待,It is important not to abuse the trust that others place in you.,他人があなたに寄せる信頼を濫用しないことが大切です。
953,vice,noun,2,10,（道徳上の）悪（⇔ virtue ⇒ 1078）；欠点,"Despite his best efforts, he found it difficult to give up his old vices.",最善の努力にもかかわらず、彼は昔からの悪癖を断つことが難しいと感じていた。
954,fate,noun,2,10,運命；結末；最期,"Despite all their efforts, they could not escape their tragic fate.",彼らはどんなに努力しても、悲劇的な運命から逃れることはできなかった。
955,tragedy,noun,2,10,悲劇（的な事態）（⇔ comedy 喜劇）,The loss of so many lives in the earthquake was an immense tragedy that affected the entire nation.,地震で多くの命が失われたことは、国全体に影響を及ぼした甚大な悲劇であった。
956,scenario,noun,2,10,（予想される）筋書き，事態；脚本,We need to prepare for the worst-case scenario to ensure we can handle any unexpected problems.,予期せぬ問題に対処できるよう、最悪の事態に備える必要があります。
957,allergy,noun,2,10,アレルギー,"Diagnosing the specific cause of an allergy often requires a series of tests, as symptoms can vary widely among individuals.",アレルギーの特定の原因を診断するには、症状が個人によって大きく異なるため、一連の検査が必要になることが多いです。
958,wound,noun,2,10,（銃弾・刃物などによる）傷；痛手,The doctor carefully cleaned the wound on the patient's arm.,医師は患者の腕の傷を注意深く消毒した。
959,antibiotic,noun,2,10,〔通例～s〕抗生物質,The doctor prescribed antibiotics to treat her bacterial infection.,医師は彼女の細菌感染症を治療するために抗生物質を処方しました。
960,vaccine,noun,2,10,ワクチン,"The development of effective vaccines has revolutionized public health, significantly reducing the incidence of many infectious diseases worldwide.",効果的なワクチンの開発は、公衆衛生に革命をもたらし、世界中で多くの感染症の発生率を著しく減少させている。
961,metaphor,noun,2,10,隠喩；比喩,"Her eloquent speech was filled with vivid metaphors, making her message both powerful and memorable.",彼女の雄弁なスピーチは鮮やかな隠喩に満ちており、彼女のメッセージを力強く、そして記憶に残るものにした。
962,folk,noun,2,10,人々；〔～s〕皆さん；〔one's ～s〕家族,It is important for all folk to have access to quality education.,すべての人々が質の高い教育を受けられることは重要です。
963,fare,noun,2,10,（乗り物の）料金,"The train fare has risen considerably, making daily commutes more expensive for many people.",電車料金がかなり値上がりし、多くの人にとって毎日の通勤費用が高くなりました。
964,transition,noun,2,10,移り変わり；過渡期,The transition from high school to university often presents a significant challenge for many students.,高校から大学への移り変わりは、多くの学生にとってしばしば大きな課題となります。
965,maximum,adjective,2,10,最大限（⇔ minimum ⇒ 653）,You should always give your maximum effort to achieve your goals.,目標を達成するために、常に最大限の努力を払うべきです。
966,galaxy,noun,2,10,星雲，銀河；〔the G～〕銀河系,Our understanding of the universe has expanded dramatically with the discovery of countless galaxies beyond our own Milky Way.,私たちの天の川銀河以外の無数の銀河が発見されたことにより、宇宙に関する私たちの理解は劇的に深まりました。
967,mineral,noun,2,10,鉱物；ミネラル,"The Earth's crust is composed of various minerals, each with unique chemical compositions and crystal structures.",地殻は様々な鉱物で構成されており、それぞれが独自の化学組成と結晶構造を持っています。
968,skeleton,noun,2,10,骨格；骨組み；概略,"Before writing the full report, the team developed a skeleton of the project proposal to ensure all key points were covered.",完全な報告書を作成する前に、チームは主要な点がすべて網羅されていることを確認するため、プロジェクト提案書の骨子を策定した。
969,counterpart,noun,2,10,相当する物［人］,"The American justice system, while sharing many fundamental principles with its British counterpart, has developed unique procedures and interpretations over centuries.",アメリカの司法制度は、英国の対応するものと多くの基本的な原則を共有しているが、数世紀を経て独自の手続きと解釈を発展させてきた。
970,stroke,noun,2,10,脳卒中；（ボールを）打つこと；（雷などの）一撃,Early recognition of the symptoms of a stroke is crucial for effective treatment.,脳卒中の症状を早期に認識することは、効果的な治療のために不可欠である。
971,pedestrian,adjective,2,10,歩行者,"Despite the intricate plot, many critics found the film's dialogue surprisingly pedestrian, failing to elevate the story.",複雑な筋書きにもかかわらず、多くの批評家はその映画の対話が驚くほど平凡だと感じ、物語を高めることができていなかった。
972,trail,noun,2,10,（野山などの）小道；跡；手がかり,The hikers followed the winding trail up the mountain.,ハイカーたちは山を登る曲がりくねった小道を進んだ。
973,ecology,noun,2,10,生態学；生態系；環境保護,Understanding basic principles of ecology is crucial for addressing contemporary environmental challenges.,生態学の基本的な原則を理解することは、現代の環境問題に対処するために不可欠です。
974,sibling,noun,2,10,きょうだい（の1人）,The bond between siblings is often one of the most enduring relationships in a person's life.,兄弟の絆は、人の人生において最も永続的な関係の一つであることがしばしばあります。
975,ratio,noun,2,10,比率,The ratio of male to female applicants for the engineering program has seen a significant shift over the last decade.,工学部の志願者における男女比は、この10年間で著しく変化した。
976,mixture,noun,2,10,混合（物）,A complex mixture of factors contributed to the economic downturn.,経済の低迷は、複雑な要因の混合が原因で生じた。
977,charm,noun,2,10,魅力；お守り,His quiet charm and quick wit made him a favorite among his colleagues.,彼の控えめな魅力と機知が、彼を同僚の間で人気者にしました。
978,ambition,noun,2,10,（～に対する）願望，野望（for）；野心,"She pursued her academic ambitions with great dedication, hoping to contribute to medical research.",彼女は医学研究への貢献を目指し、多大な熱意をもって学術的な野望を追求した。
979,prominent,adjective,2,10,卓越した；目立つ,"She played a prominent role in the negotiation, contributing significantly to its successful outcome.",彼女は交渉において重要な役割を果たし、その成功に大きく貢献しました。
980,radical,adjective,2,10,急進的な；根本的な,The new CEO proposed a radical restructuring of the company to improve efficiency.,新しいCEOは効率を向上させるため、会社の抜本的な再編を提案した。
981,prompt,adjective,2,10,即座の，迅速な,We expect a prompt response to our inquiry so we can proceed with the project without delay.,私たちは遅延なくプロジェクトを進められるよう、私たちの問い合わせに対し迅速な返答を期待しています。
982,informal,adjective,2,10,形式ばらない，略式の（⇔ formal 正式の）；（言葉が）くだけた,"His speech was informal, but very effective in connecting with the audience.",彼のスピーチは形式ばらないものだったが、聴衆の心をつかむのに非常に効果的だった。
983,mutual,adjective,2,10,相互の；共通の,Their cooperation was based on mutual trust and benefit.,彼らの協力は相互の信頼と利益に基づいていた。
984,neutral,adjective,2,10,中立の；（特徴・表情などが）はっきりしない,The moderator must remain neutral to ensure a fair debate.,公正な討論を確実にするために、司会者は中立であるべきです。
985,alert,adjective,2,10,警戒して；敏速な,Drivers must remain alert for unexpected obstacles on the road.,運転手は、路上で予期せぬ障害物に常に警戒していなければならない。
986,magnetic,adjective,2,10,磁気の；磁石の；人を引きつける,His magnetic personality made him popular among his classmates.,彼の魅力的な人柄は、クラスメートの間で彼を人気者にしました。
987,polar,adjective,2,10,極地の；電極の,The polar regions of the Earth are home to unique species adapted to extreme cold.,地球の極地には、極度の寒さに適応したユニークな種が生息しています。
988,fluent,adjective,2,10,流ちょうな,"To become fluent in a foreign language, consistent practice is essential.",外国語を流暢に話せるようになるためには、継続的な練習が不可欠です。
989,external,adjective,2,10,外部の（⇔ internal ⇒ 680）；対外的な,The company's success depends not only on internal strategies but also on various external factors such as market trends and economic conditions.,その会社の成功は、社内戦略だけでなく、市場動向や経済状況といった様々な外部要因にも左右される。
990,passive,adjective,2,10,受動的な；消極的な,His passive nature often led him to follow others rather than take initiative.,彼の消極的な性格は、率先して行動するよりも他人に従うことになりがちだった。
991,awful,adjective,2,10,ひどい；嫌な；ものすごい,The movie was so awful that I left the cinema halfway through.,その映画はあまりにもひどかったので、私は途中で映画館を出ました。
992,unrelated,adjective,2,10,無関係の；血縁関係がない,"The two seemingly unrelated events were, in fact, caused by the same underlying factor.",一見無関係に見える二つの出来事は、実は同じ根本的な要因によって引き起こされた。
993,cruel,adjective,2,10,残酷な；むごい,Many people consider it cruel to keep wild animals in small cages for entertainment.,多くの人々は、娯楽のために野生動物を小さな檻に入れるのは残酷だと考えています。
994,fake,adjective,2,10,偽の；見せかけだけの,Many people are concerned about the spread of fake news on social media platforms.,多くの人々がソーシャルメディア上でのフェイクニュースの拡散を懸念しています。
995,vulnerable,adjective,2,10,（攻撃などに）弱い，もろい；傷つきやすい,Small children are particularly vulnerable to serious infections.,幼い子供たちは特に重い感染症にかかりやすい。
996,urgent,adjective,2,10,緊急の,The hospital issued an urgent appeal for blood donors after a major accident.,病院は、大事故発生後、献血者への緊急の呼びかけを行いました。
997,spiritual,adjective,2,10,精神の（⇔ material ⇒ 73）；霊的な,Many people seek a deeper spiritual meaning in their lives beyond material possessions.,多くの人々は、物質的な豊かさだけでなく、人生においてより深い精神的な意味を求めている。
998,modest,adjective,2,10,謙虚な（≒ humble）；適度な；質素な,"Despite his brilliant achievements, he remained modest about his success.",彼は輝かしい功績を収めたにもかかわらず、自身の成功については謙虚なままであった。
999,keen,adjective,2,10,熱心な；鋭敏な；（感情・関心などが）強い,Many students are keen on studying abroad to broaden their horizons.,多くの学生は視野を広げるために海外留学に熱心である。
1000,nonetheless,adverb,2,10,それにもかかわらず，それでもなお（≒ nevertheless）,"The project faced numerous challenges; nonetheless, the team managed to deliver outstanding results.",そのプロジェクトは数多くの課題に直面した。それにもかかわらず、チームは素晴らしい成果を上げることができた。
1001,negotiate,verb,2,11,交渉する；を（交渉して）取り決める,It took many hours of intense discussion to negotiate a compromise between the striking workers and the management.,ストライキ中の労働者と経営陣の間で妥協案を交渉するためには、何時間にもわたる白熱した議論が必要だった。
1002,grasp,verb,2,11,を把握［理解］する；をしっかり握る,It took him a long time to grasp the full implications of the new policy.,彼がその新しい政策の全体的な意味合いを把握するのに長い時間がかかった。
1003,donate,verb,2,11,を寄付する；（臓器・血液）を提供する,Many people choose to donate blood to help those in need.,多くの人が困っている人を助けるために献血することを選びます。
1004,arrest,verb,2,11,を逮捕する；を止める；（注意）を引く,The police decided to arrest the suspect after gathering sufficient evidence.,警察は十分な証拠を集めた後、容疑者を逮捕することを決定した。
1005,crack,verb,2,11,ひびが入る；にひびを入れる,The extreme cold caused the windowpane to crack.,極度の寒さで窓ガラスにひびが入った。
1006,tap,verb,2,11,を軽くたたく；（液体）を出す；を盗聴する,He gently tapped her on the shoulder to get her attention.,彼は彼女の注意を引くために、そっと彼女の肩をたたいた。
1007,split,verb,2,11,を分割する；を分担する；分裂する,The company decided to split its operations into two separate divisions to increase efficiency.,会社は効率を高めるために、事業を2つの独立した部門に分割することを決定した。
1008,forecast,verb,2,11,を予想［予測］する,The government forecasts a 2% economic growth next year.,政府は来年2%の経済成長を予測している。
1009,exclude,verb,2,11,を除外する（⇔include を含む）,Applicants who do not meet all the requirements will be excluded from consideration.,すべての要件を満たさない応募者は、検討対象から除外されます。
1010,overlook,verb,2,11,を見落とす；を大目に見る；を見渡す,It's easy to overlook small details when you're focusing on the bigger picture.,大局に集中していると、細かい点を見落としがちだ。
